{
  "schema": "icecream-execution-v2",
  "scenario_digest": "9411bba01333a1ff6340d8a5de141e0e246467c7e9a8c3ae90d156587abafa51",
  "mode": "simulated",
  "runner_commit": "4920b68995599eed94d8910930a803bd477b4803",
  "host_manifest": "594d5ddd35aedb47f00d9c34d140017907a5b9f93c975aba125fc924daac5c07",
  "started_at": "2026-08-22T00:43:03-04:00",
  "source_commit": "4920b68995599eed94d8910930a803bd477b4803",
  "simulator_commit": "4920b68995599eed94d8910930a803bd477b4803",
  "codec_executable_digest": "688903f106546d5e6a228efa7991340d0cec3a10d02300c0180b94762ea853c3",
  "input_manifest_digests": [
    "5cb0ecacfd3f84e48ff80aff99738d2232964c797b583caa586582de5b9f5636"
  ],
  "image_identifiers": [
    "resident-fixture@sha256:2222222222222222222222222222222222222222222222222222222222222222"
  ],
  "compiler_versions": [
    "r4-fixture-compiler (modeled)"
  ],
  "library_versions": [
    "python-jsonschema 4.26.0"
  ],
  "host_identities": [
    "retained-r4-fixture"
  ]
}
